{
  "$schema": "http://json-schema.org/draft-07/schema#",
  "title": "Founder Jam Config",
  "description": "Optional Claude Code convenience file. It mirrors the FOUNDER JAM HANDOFF block defined in the founder-setup skill. claude.ai and Claude desktop users paste the handoff block instead and need no file.",
  "type": "object",
  "properties": {
    "startup_name": {
      "type": "string",
      "description": "Name of the startup"
    },
    "path": {
      "type": "string",
      "enum": [
        "product-positioning",
        "gtm-growth",
        "sales",
        "ops-automation",
        "undecided"
      ],
      "default": "undecided",
      "description": "The founder's path, chosen with their sherpa during Focus"
    },
    "stage": {
      "type": "string",
      "enum": [
        "idea",
        "pre-revenue",
        "early-revenue"
      ],
      "description": "Current startup stage"
    },
    "problem_statement": {
      "type": "string",
      "description": "The core problem your startup solves"
    },
    "target_market": {
      "type": "string",
      "description": "Who you are building for"
    },
    "team_size": {
      "type": "integer",
      "minimum": 1,
      "description": "Number of people on the team"
    },
    "traction": {
      "type": "string",
      "description": "Current traction: users, revenue, waitlist, LOIs, etc."
    },
    "mode": {
      "type": "string",
      "enum": [
        "",
        "solo",
        "with-sherpa"
      ],
      "default": "",
      "description": "empty = not asked yet (skills ask once whether a sherpa is present); solo = no challenge prompts; with-sherpa = skills add challenge questions the sherpa or founder can ask"
    },
    "icp_segment": {
      "type": "string",
      "description": "Selected beachhead ICP segment (set by icp-definer)"
    },
    "top_pains": {
      "type": "string",
      "description": "The 1-2 pains the beachhead segment feels most (set by icp-definer)"
    },
    "hypothesis_selected": {
      "type": "string",
      "description": "Winning hypothesis statement (set by hypothesis-engine)"
    },
    "channels_selected": {
      "type": "array",
      "items": {
        "type": "string"
      },
      "description": "Primary distribution channels (set by icp-definer or growth-builder)"
    },
    "lead_magnet": {
      "type": "string",
      "description": "Selected lead magnet type and title (set by offer-designer)"
    },
    "business_type": {
      "type": "string",
      "enum": [
        "b2b-saas",
        "services",
        "marketplace",
        "consumer",
        ""
      ],
      "description": "Business model type for tailored recommendations"
    },
    "outbound_system": {
      "type": "string",
      "description": "One-line summary of the founder-led outbound system: channels, cadence, CTA, tier (set by outbound-composer)"
    },
    "published_pages": {
      "type": "array",
      "items": {
        "type": "object",
        "properties": {
          "purpose": {
            "type": "string",
            "enum": [
              "lead-magnet-gate",
              "ab-test-a",
              "ab-test-b",
              "scoreboard",
              "demo"
            ]
          },
          "url": {
            "type": "string"
          },
          "name": {
            "type": "string"
          },
          "gate": {
            "type": "string",
            "enum": [
              "email",
              "password",
              "none"
            ]
          }
        },
        "required": [
          "purpose",
          "url"
        ]
      },
      "description": "Live pages published during or after the workshop (set by page-launcher). In the handoff block this is a comma-separated list of purpose=url pairs."
    }
  },
  "required": [
    "startup_name",
    "path",
    "stage",
    "problem_statement",
    "target_market"
  ]
}
