{
  "startup_name": "",
  "path": "undecided",
  "stage": "idea",
  "problem_statement": "",
  "target_market": "",
  "team_size": 1,
  "traction": "",
  "mode": "solo",
  "icp_segment": "",
  "top_pains": "",
  "hypothesis_selected": "",
  "channels_selected": [],
  "lead_magnet": "",
  "business_type": "",
  "outbound_system": "",
  "published_pages": []
}
